doi,label,title,year,journal,ct_label_v2,ct_membership_score_v2,ct_score,citations_rank,openalex_cited_by_count,dimensions_times_cited,altmetric_score,mendeley_reader_count,openalex_top_concepts,period
10.1109/icalt.2017.161,Design Thinking in App Inventor Game Design and Development: A Case Study,Design Thinking in App Inventor Game Design and Development: A Case Study,2017,2017 IEEE 17TH INTERNATIONAL CONFERENCE ON ADVANCED LEARNING TECHNOLOGIES (ICALT),broad,0.7250000000000001,3,21.0,21.0,23.0,,104.0,Computational thinking; Game design; Design thinking; Mathematics education; Computer science,p2_2013_2019
10.1109/tale.2016.7851769,Teaching and learning computational thinking through solving problems in Artificial Intelligence: On designing introductory engineering and ,Teaching and learning computational thinking through solving problems in Artificial Intelligence: On designing introductory engineering and computing courses,2017,,core,1.0,3,21.0,21.0,21.0,,93.0,Computational thinking; Computer science; Abstraction; Logical reasoning; Mathematics education,p2_2013_2019
10.1109/fie.2015.7344063,DISSECT: Exploring the relationship between computational thinking and English literature in K-12 curricula,DISSECT: Exploring the relationship between computational thinking and English literature in K-12 curricula,2015,"Proceedings - Frontiers in Education Conference, FIE",broad,0.5416666666666667,3,21.0,21.0,19.0,,127.0,Computational thinking; Curriculum; Mathematics education; Bridge (graph theory); Computer science,p2_2013_2019
10.1145/2676723.2677269,Closing the cyberlearning loop: Enabling teachers to formatively assess student programming projects,Closing the cyberlearning loop: Enabling teachers to formatively assess student programming projects,2015,,broad,0.7250000000000001,3,21.0,21.0,19.0,,81.0,Summative assessment; Computational thinking; Mathematics education; Computer science; Curriculum,p2_2013_2019
10.1080/00330124.2018.1518720,Cyber Literacy for GIScience: Toward Formalizing Geospatial Computing Education,Cyber Literacy for GIScience: Toward Formalizing Geospatial Computing Education,2019,Professional Geographer,broad,0.6666666666666667,2,20.0,20.0,20.0,11.499999999999998,100.0,Geospatial analysis; Pace; Data science; Literacy; Computer science,p2_2013_2019
10.1145/3349266.3351410,Combining block-based programming and hardware prototyping to foster computational thinking,Combining block-based programming and hardware prototyping to foster computational thinking,2019,PROCEEDINGS OF THE 20TH ANNUAL CONFERENCE ON INFORMATION TECHNOLOGY EDUCATION (SIGITE '19),core,0.8166666666666667,3,20.0,20.0,21.0,,70.0,Computational thinking; Computer science; Coding (social sciences); Block (permutation group theory); Software,p2_2013_2019
10.1145/3362789.3362813,Implementation of unplugged teaching activities to foster computational thinking skills in primary school from a gender perspective,Implementation of unplugged teaching activities to foster computational thinking skills in primary school from a gender perspective,2019,ACM International Conference Proceeding Series,core,1.0,3,20.0,20.0,16.0,2.35,148.0,Computational thinking; Empowerment; Context (archaeology); Gender equity; Perspective (graphical),p2_2013_2019
10.20897/ejsteme/5772,Revisiting Second Graders’ Robotics with an Understand/Use-Modify-Create (U2MC) Strategy,Revisiting Second Graders’ Robotics with an Understand/Use-Modify-Create (U2MC) Strategy,2019,European Journal of STEM Education,core,1.0,3,20.0,20.0,20.0,,59.0,Robotics; Computational thinking; Artificial intelligence; Curriculum; Educational robotics,p2_2013_2019
10.1080/07380569.2018.1531613,An Evaluation of Primary School Children Coding Using a Text-Based Language (Java),An Evaluation of Primary School Children Coding Using a Text-Based Language (Java),2018,Computers in the Schools,broad,0.5416666666666667,3,20.0,20.0,18.0,,89.0,Computational thinking; Coding (social sciences); Computer science; Java; Mathematics education,p2_2013_2019
10.4324/9781351232357,Guided tinkering as a design for learning programming,Guided tinkering as a design for learning programming,2018,,core,0.8500000000000001,2,20.0,20.0,50.0,,17.0,Networked learning; Reading (process); Literacy; Citizen journalism; Learning sciences,p2_2013_2019
10.1109/fie.2017.8190682,An operationalized model for defining Computational Thinking,An operationalized model for defining Computational Thinking,2017,"Proceedings - Frontiers in Education Conference, FIE",core,0.8166666666666667,3,20.0,20.0,14.0,,77.0,Operationalization; Computer science; Field (mathematics); Data science; Management science,p2_2013_2019
10.1109/fie.2015.7344113,CodePlus - Designing an after school computing programme for girls,CodePlus - Designing an after school computing programme for girls,2015,"Proceedings - Frontiers in Education Conference, FIE",broad,0.575,2,20.0,20.0,22.0,,82.0,Perception; Field (mathematics); Computer Science and Engineering; Computer science; Summer camp,p2_2013_2019
10.1109/fie.2015.7344240,DISSECT: An experiment in infusing computational thinking in a sixth grade classroom,DISSECT: An experiment in infusing computational thinking in a sixth grade classroom,2015,"Proceedings - Frontiers in Education Conference, FIE",core,0.8500000000000001,2,20.0,20.0,15.0,,68.0,Computational thinking; Curriculum; Mathematics education; Computer science; Work (physics),p2_2013_2019
10.1109/fie.2015.7344241,DISSECT: Analysis of pedagogical techniques to integrate computational thinking into K-12 curricula,DISSECT: Analysis of pedagogical techniques to integrate computational thinking into K-12 curricula,2015,"Proceedings - Frontiers in Education Conference, FIE",broad,0.7250000000000001,3,20.0,20.0,18.0,,88.0,Computational thinking; Curriculum; Mathematics education; Computer science; Vocabulary,p2_2013_2019
10.1007/978-981-13-6528-7_7,Introducing and Assessing Computational Thinking in the Secondary Science Classroom,Introducing and Assessing Computational Thinking in the Secondary Science Classroom,2019,,broad,0.5416666666666667,3,19.0,19.0,19.0,,89.0,Computational thinking; Affordance; Curriculum; Mathematics education; Best practice,p2_2013_2019
10.1016/j.jss.2019.110401,Cooperative Thinking: Analyzing a new framework for software engineering education,Cooperative Thinking: Analyzing a new framework for software engineering education,2019,Journal of Systems and Software,core,0.8166666666666667,3,19.0,19.0,20.0,3.0,171.0,Agile software development; Software development; Computational thinking; Computer science; Software,p2_2013_2019
10.1108/ils-05-2018-0035,Teachers’ goals predict computational thinking gainsin robotics,Teachers’ goals predict computational thinking gainsin robotics,2019,Information and Learning Science,broad,0.5416666666666667,3,19.0,19.0,18.0,2.45,98.0,Curriculum; Computational thinking; Robotics; Originality; Mathematics education,p2_2013_2019
10.1109/fie43999.2019.9028384,Analyzing the Effect of Computational Thinking on Mathematics through Educational Robotics,Analyzing the Effect of Computational Thinking on Mathematics through Educational Robotics,2019,"Proceedings - Frontiers in Education Conference, FIE",core,1.0,3,19.0,19.0,17.0,,94.0,Robotics; Artificial intelligence; Computational thinking; Educational robotics; Context (archaeology),p2_2013_2019
10.1145/3287324.3287452,"Computational thinking in the Danish high school: Learning coding, modeling, and content knowledge with Netlogo","Computational thinking in the Danish high school: Learning coding, modeling, and content knowledge with Netlogo",2019,SIGCSE '19: PROCEEDINGS OF THE 50TH ACM TECHNICAL SYMPOSIUM ON COMPUTER SCIENCE EDUCATION,broad,0.6333333333333333,3,19.0,19.0,25.0,,67.0,NetLogo; Computational thinking; Mathematics education; Computer science; Thematic analysis,p2_2013_2019
10.1145/3290605.3300744,“It broadens my mind”: Empowering people with cognitive disabilities through computing education,“It broadens my mind”: Empowering people with cognitive disabilities through computing education,2019,Conference on Human Factors in Computing Systems - Proceedings,core,0.8500000000000001,2,19.0,19.0,24.0,,88.0,Leverage (statistics); Empowerment; Curriculum; Computational thinking; Cognition,p2_2013_2019
10.1007/978-3-319-62875-2_9,Creativity and contextualization activities in educational robotics to improve engineering and computational thinking,Creativity and contextualization activities in educational robotics to improve engineering and computational thinking,2018,Advances in Intelligent Systems and Computing,broad,0.7250000000000001,3,19.0,19.0,21.0,,68.0,Contextualization; Robotics; Computational thinking; Creativity; Artificial intelligence,p2_2013_2019
10.1007/978-3-319-93566-9_7,Preparing pre-service teachers to promote computational thinking in school classrooms,Preparing pre-service teachers to promote computational thinking in school classrooms,2018,,core,0.8166666666666667,3,19.0,19.0,20.0,,75.0,Computational thinking; Scripting language; Mathematics education; Context (archaeology); Computer science,p2_2013_2019
10.1007/s10639-017-9658-2,Exploring computer science students’ continuance intentions to use Kattis,Exploring computer science students’ continuance intentions to use Kattis,2018,Education and Information Technologies,core,0.8500000000000001,2,19.0,19.0,17.0,,60.0,Continuance; Educational technology; Science education; Mathematics education; Computer-mediated communication,p2_2013_2019
10.1007/978-3-319-52691-1_2,Making Computer Science Attractive to High School Girls with Computational Thinking Approaches: A Case Study,Making Computer Science Attractive to High School Girls with Computational Thinking Approaches: A Case Study,2017,"EMERGING RESEARCH, PRACTICE, AND POLICY ON COMPUTATIONAL THINKING",core,0.8166666666666667,3,19.0,19.0,18.0,,29.0,Computational thinking; Mathematics education; Computer science; Psychology,p2_2013_2019
10.1007/978-3-319-71483-7_9,Promoting computational thinking skills: Would you use this bebras task?,Promoting computational thinking skills: Would you use this bebras task?,2017,Lecture Notes in Computer Science,core,0.8500000000000001,2,19.0,19.0,13.0,,39.0,Computational thinking; Computer science; Informatics; Task (project management); Interview,p2_2013_2019
10.1080/13614568.2016.1152314,Leveraging Scratch4SL and Second Life to motivate high school students’ participation in introductory programming courses: findings from a c,Leveraging Scratch4SL and Second Life to motivate high school students’ participation in introductory programming courses: findings from a case study,2017,New Review of Hypermedia and Multimedia,core,1.0,3,19.0,19.0,20.0,,115.0,Constructionism; Computational thinking; Mathematics education; Computer science; Focus group,p2_2013_2019
10.17051/io.2017.80833,Ict teachers’ visual programming teaching experiences; Bilişim teknolojileri öğretmenlerinin görsel programlama öğretimi deneyimleri,Ict teachers’ visual programming teaching experiences; Bilişim teknolojileri öğretmenlerinin görsel programlama öğretimi deneyimleri,2017,Elementary Education Online,broad,0.575,2,19.0,19.0,20.0,,16.0,Psychology,p2_2013_2019
10.1007/978-981-13-6528-7_4,"Measuring Secondary School Students’ Competence in Computational Thinking in ICILS 2018—Challenges, Concepts, and Potential Implications for","Measuring Secondary School Students’ Competence in Computational Thinking in ICILS 2018—Challenges, Concepts, and Potential Implications for School Systems Around theWorld",2019,,broad,0.6333333333333333,3,18.0,18.0,15.0,,43.0,Computational thinking; Competence (human resources); Scope (computer science); Mathematics education; Perspective (graphical),p2_2013_2019
10.1088/1742-6596/1317/1/012172,Factors influencing the critical and creative thinking skills of college students in computational physics courses,Factors influencing the critical and creative thinking skills of college students in computational physics courses,2019,Journal of Physics: Conference Series,core,0.8166666666666667,3,18.0,18.0,16.0,,123.0,Mathematics education; Curiosity; Computational thinking; Subject (documents); Likert scale,p2_2013_2019
10.1007/978-3-319-93566-9_13,Integrating computational thinking in school curriculum,Integrating computational thinking in school curriculum,2018,,core,0.8166666666666667,3,18.0,18.0,23.0,,120.0,Curriculum; Computational thinking; Globe; Mathematics education; Engineering ethics,p2_2013_2019
10.1109/compsac.2018.00175,Computational Thinking: Learning by Doing with the Cinco Adventure Game Tool,Computational Thinking: Learning by Doing with the Cinco Adventure Game Tool,2018,Proceedings - IEEE Computer Society's International Computer Software and Applications Conference,broad,0.5416666666666667,3,18.0,18.0,18.0,,53.0,Computational thinking; Computer science; Adventure; Reuse; Video game development,p2_2013_2019
10.1109/isecon.2018.8340502,Towards playful learning and computational thinking-Developing the educational robot BRICKO,Towards playful learning and computational thinking-Developing the educational robot BRICKO,2018,,broad,0.6333333333333333,3,18.0,18.0,21.0,,67.0,Computational thinking; Computer science; Robot; Human–computer interaction; Educational robotics,p2_2013_2019
10.1007/978-3-319-52691-1_10,Using Model-Based Learning to Promote Computational Thinking Education,Using Model-Based Learning to Promote Computational Thinking Education,2017,"EMERGING RESEARCH, PRACTICE, AND POLICY ON COMPUTATIONAL THINKING",core,1.0,3,18.0,18.0,16.0,,55.0,Computational thinking; Context (archaeology); Discipline; Curriculum; Computer science,p2_2013_2019
10.1021/acs.jchemed.6b00973,The Development of Computational Thinking in a High School Chemistry Course,The Development of Computational Thinking in a High School Chemistry Course,2017,Journal of Chemical Education,core,1.0,3,18.0,18.0,17.0,2.6,151.0,Computational thinking; Mathematics education; Computer science; Coding (social sciences); Science education,p2_2013_2019
10.1109/tale.2017.8252356,Integrating computational thinking into english dialogue learning through graphical programming tool,Integrating computational thinking into english dialogue learning through graphical programming tool,2017,,broad,0.6333333333333333,3,18.0,18.0,17.0,,80.0,Computer science; Visual programming language; First-generation programming language; Computational thinking; Mathematics education,p2_2013_2019
10.1109/fie.2016.7757409,Can Computational Thinking help me? A quantitative study of its effects on education,Can Computational Thinking help me? A quantitative study of its effects on education,2016,"Proceedings - Frontiers in Education Conference, FIE",core,1.0,3,18.0,18.0,18.0,,114.0,Computational thinking; Computer science; Mathematics education; Artificial intelligence; Psychology,p2_2013_2019
10.1145/3012430.3012496,Does computational thinking correlate with personality? The non-cognitive side of computational thinking,Does computational thinking correlate with personality? The non-cognitive side of computational thinking,2016,ACM International Conference Proceeding Series,broad,0.6333333333333333,3,18.0,18.0,14.0,,94.0,Conscientiousness; Agreeableness; Extraversion and introversion; Openness to experience; Personality,p2_2013_2019
10.1109/blocks.2015.7368995,Quizly: A live coding assessment platform for App Inventor,Quizly: A live coding assessment platform for App Inventor,2015,,broad,0.5416666666666667,3,18.0,18.0,18.0,3.0,61.0,Computational thinking; Summative assessment; Computer science; Formative assessment; Affordance,p2_2013_2019
10.1109/vlhcc.2015.7357215,Collaboration and Computational Thinking: A classroom structure,Collaboration and Computational Thinking: A classroom structure,2015,"Proceedings of IEEE Symposium on Visual Languages and Human-Centric Computing, VL/HCC",core,1.0,3,18.0,18.0,10.0,,66.0,Computational thinking; Summative assessment; Mathematics education; Computer science; Ideal (ethics),p2_2013_2019
10.1007/978-3-030-33759-9_4,Holistic STEAM Education Through Computational Thinking: A Perspective on Training Future Teachers,Holistic STEAM Education Through Computational Thinking: A Perspective on Training Future Teachers,2019,Lecture Notes in Computer Science,core,0.8166666666666667,3,17.0,17.0,18.0,,83.0,Novelty; Computational thinking; Articulation (sociology); Perspective (graphical); Context (archaeology),p2_2013_2019
10.1109/access.2018.2890220,Developing a Software That Supports the Improvement of the Theory of Mind in Children With Autism Spectrum Disorder,Developing a Software That Supports the Improvement of the Theory of Mind in Children With Autism Spectrum Disorder,2019,IEEE ACCESS,broad,0.7000000000000001,1,17.0,17.0,14.0,,87.0,Usability; Autism spectrum disorder; Empathy; Computer science; Autism,p2_2013_2019
10.12700/aph.16.2.2019.2.3,Placing event-action-based visual programming in the process of computer science education,Placing event-action-based visual programming in the process of computer science education,2019,Acta Polytechnica Hungarica,core,1.0,3,17.0,17.0,12.0,,44.0,Computer science; Action (physics); Process (computing); Event (particle physics); Human–computer interaction,p2_2013_2019
10.33965/celda2019_201911l023,Measuring computational thinking - Adapting a performance test and a self-assessment instrument for German-speaking countries,Measuring computational thinking - Adapting a performance test and a self-assessment instrument for German-speaking countries,2019,,broad,0.5416666666666667,3,17.0,17.0,18.0,,88.0,German; Computational thinking; Test (biology); Computer science; Work (physics),p2_2013_2019
10.1145/3202185.3210800,Game modding for computational thinking: An integrated design approach,Game modding for computational thinking: An integrated design approach,2018,PROCEEDINGS OF THE 2018 ACM CONFERENCE ON INTERACTION DESIGN AND CHILDREN (IDC 2018),core,1.0,3,17.0,17.0,16.0,5.0,61.0,Mod; Affordance; Computer science; Human–computer interaction; Process (computing),p2_2013_2019
10.1007/978-3-319-52691-1_15,The Code ABC MOOC: Experiences from a Coding and Computational Thinking MOOC for Finnish Primary School Teachers,The Code ABC MOOC: Experiences from a Coding and Computational Thinking MOOC for Finnish Primary School Teachers,2017,"EMERGING RESEARCH, PRACTICE, AND POLICY ON COMPUTATIONAL THINKING",broad,0.5416666666666667,3,17.0,17.0,16.0,4.6,26.0,Coding (social sciences); Computational thinking; Curriculum; Mathematics education; School teachers,p2_2013_2019
10.1109/coginfocom.2017.8268230,Sprego virtual collaboration space,Sprego virtual collaboration space,2017,,broad,0.6333333333333333,3,17.0,17.0,11.0,,24.0,Workspace; Computer science; Computational thinking; Popularity; Human–computer interaction,p2_2013_2019
10.1145/3144826.3145354,Promotng computatonal thinking and creatveness in primary school children,Promotng computatonal thinking and creatveness in primary school children,2017,ACM International Conference Proceeding Series,core,1.0,3,17.0,17.0,10.0,,85.0,Computational thinking; Computer science; Creativity; Context (archaeology); Coding (social sciences),p2_2013_2019
10.1007/978-3-319-30295-9_14,Computational thinking: Toward a unifying definition,Computational thinking: Toward a unifying definition,2016,,broad,0.5416666666666667,3,17.0,17.0,18.0,,66.0,Computer science; Epistemology; Cognitive science; Management science; Psychology,p2_2013_2019
10.1007/978-3-319-41769-1_9,"Computational thinking and social skills in Virtuoso: An immersive, digital game-based learning environment for youth with autism spectrum d","Computational thinking and social skills in Virtuoso: An immersive, digital game-based learning environment for youth with autism spectrum disorder",2016,Communications in Computer and Information Science,broad,0.5416666666666667,3,17.0,17.0,20.0,,76.0,Computational thinking; Autism spectrum disorder; Curriculum; Autism; Computer science,p2_2013_2019
10.1145/2930674.2930697,How different input and output modalities support coding as a problem-solving process for children,How different input and output modalities support coding as a problem-solving process for children,2016,PROCEEDINGS OF THE 15TH INTERNATIONAL CONFERENCE ON INTERACTION DESIGN AND CHILDREN (IDC2016),broad,0.6333333333333333,3,17.0,17.0,13.0,,63.0,Coding (social sciences); Computer science; Affordance; Modalities; Computational thinking,p2_2013_2019
10.1145/2983468.2983517,Promoting inclusive informatics education through the Bebras challenge to All K-12 students,Promoting inclusive informatics education through the Bebras challenge to All K-12 students,2016,ACM International Conference Proceeding Series,broad,0.5416666666666667,3,17.0,17.0,12.0,,41.0,CONTEST; Informatics; Engineering informatics; Business informatics; Computer science,p2_2013_2019
10.15388/ioi.2016.09,Programming in Slovak primary schools,Programming in Slovak primary schools,2016,Olympiads in Informatics,broad,0.575,2,17.0,17.0,20.0,3.0,39.0,Slovak; Primary (astronomy); Mathematics education; Political science; Psychology,p2_2013_2019
10.1007/978-3-319-12307-3_58,Computational thinking and simulation in teaching science and mathematics,Computational thinking and simulation in teaching science and mathematics,2015,Springer Proceedings in Mathematics and Statistics,broad,0.6333333333333333,3,17.0,17.0,9.0,,59.0,Abstraction; Scratch; Computer science; Computational thinking; Mathematics education,p2_2013_2019
10.1109/fie.2014.7044089,AliCe-ViLlagE Alice as a Collaborative Virtual Learning Environment,AliCe-ViLlagE Alice as a Collaborative Virtual Learning Environment,2015,"Proceedings - Frontiers in Education Conference, FIE",broad,0.575,2,17.0,17.0,13.0,,51.0,Alice (programming language); Computer science; Domain (mathematical analysis); Teamwork; Process (computing),p2_2013_2019
10.1145/2787622.2787720,Grounding computational thinking skill acquisition through contextualized instruction,Grounding computational thinking skill acquisition through contextualized instruction,2015,,core,1.0,3,17.0,17.0,14.0,0.5,114.0,Computational thinking; Computer science; Curriculum; Framing (construction); Set (abstract data type),p2_2013_2019
10.1080/08993408.2014.963360,Mapping students’ ideas to understand learning in a collaborative programming environment,Mapping students’ ideas to understand learning in a collaborative programming environment,2014,Computer Science Education,broad,0.6333333333333333,3,17.0,17.0,14.0,,77.0,Computer science; Collaborative learning; Context (archaeology); Mathematics education; Constructivist teaching methods,p2_2013_2019
10.15388/infedu.2014.04,Multi-sensory informatics education,Multi-sensory informatics education,2014,Informatics in Education,broad,0.7250000000000001,3,17.0,17.0,19.0,,63.0,Slovak; Mathematics education; Teaching method; Computer science; Mathematics,p2_2013_2019
10.1007/978-3-319-73417-0_12,Measurement of Computational Thinking in K-12 Education: The Need for Innovative Practices,Measurement of Computational Thinking in K-12 Education: The Need for Innovative Practices,2018,,core,1.0,3,16.0,16.0,18.0,3.5,49.0,Computational thinking; Suite; Curriculum; Process (computing); Mathematics education,p2_2013_2019
10.1145/3213818.3213829,Considerations and technical pitfalls for teaching computational thinking with BBC micro:bit,Considerations and technical pitfalls for teaching computational thinking with BBC micro:bit,2018,ACM International Conference Proceeding Series,core,1.0,3,16.0,16.0,14.0,,69.0,Computational thinking; Computer science; Curriculum; Bit (key); Microcontroller,p2_2013_2019
10.1145/3284179.3284191,Teaching computational thinking to Down syndrome students,Teaching computational thinking to Down syndrome students,2018,ACM International Conference Proceeding Series,core,1.0,3,16.0,16.0,17.0,,75.0,Computational thinking; Computer science; Comprehension; Mathematics education; Cognition,p2_2013_2019
10.1007/978-3-319-52836-6_19,A pathway into computational thinking in primary schools,A pathway into computational thinking in primary schools,2017,Lecture Notes in Computer Science,broad,0.6333333333333333,3,16.0,16.0,16.0,3.0,74.0,Computational thinking; Computer science; Curriculum; Creativity; Key (lock),p2_2013_2019
10.1109/mcse.2017.3151241,The Essence of Computational Thinking,The Essence of Computational Thinking,2017,Computing in Science and Engineering,core,0.8500000000000001,2,16.0,16.0,10.0,0.25,66.0,Computational thinking; Computer science; Set (abstract data type); Cognition; Mathematics education,p2_2013_2019
10.1145/3141798.3141808,The role of computational thinking practices in making: How beginning youth makers encounter & appropriate ct practices in making,The role of computational thinking practices in making: How beginning youth makers encounter & appropriate ct practices in making,2017,ACM International Conference Proceeding Series,broad,0.7250000000000001,3,16.0,16.0,22.0,,48.0,Debugging; Context (archaeology); Computational thinking; Assertion; Computer science,p2_2013_2019
10.1109/vlhcc.2016.7739692,Fostering computational thinking skills with a tangible blocks programming environment,Fostering computational thinking skills with a tangible blocks programming environment,2016,"Proceedings of IEEE Symposium on Visual Languages and Human-Centric Computing, VL/HCC",core,0.8500000000000001,2,16.0,16.0,14.0,,60.0,Computational thinking; Computer science; Interface (matter); Scratch; Human–computer interaction,p2_2013_2019
